no_space_left_in_inventory,No space left.,No space left.,Kein Platz mehr.,没有剩余空间。,沒有剩餘空間。,Нет места.,Nezbývá místo.,Brak miejsca.,Nincs hely.,Nessuno spazio rimasto.,Il n'y a plus d'espace.,Il n'y a plus d'espace.,Sem espaço sobrando.,スペースが残っていません。,
you_got,You got,You got,Du bekommst,你得到了,你得到了,Ты получил,Máš,Masz,Neked van,Tu hai,Vous avez,Vous avez,Você tem,あなたが得た,
not_enough_money,You do not have enough money with you.,You do not have enough money with you.,Du hast nicht genug Geld dabei.,您没有足够的钱。,您沒有足夠的錢。,У тебя с собой не хватает денег.,Nemáte s sebou dost peněz.,Nie masz przy sobie wystarczająco dużo pieniędzy.,Nincs elég pénzed magaddal.,Non hai abbastanza soldi con te.,Vous n'avez pas assez d'argent avec vous.,Vous n'avez pas assez d'argent avec vous.,Você não tem dinheiro suficiente com você.,あなたはあなたと十分なお金を持っていません。,
your_already_have_the_licence,You already have the license.,You already have the license.,Du hast die Lizenz bereits,您已经有许可证。,您已經有許可證。,У вас уже есть лицензия.,Licenci již máte.,Masz już licencję.,Már megvan az engedély.,Hai già la licenza.,Vous avez déjà la licence.,Vous avez déjà la licence.,Você já tem a licença.,あなたはすでにライセンスを持っています。,
you_have_not_the_dependency_licence,You have not purchased the required license.,You have not purchased the required license.,Du hast nicht die abhängige Lizenz erworben.,您尚未购买所需的许可证。,您尚未購買所需的許可證。,Вы не приобрели необходимую лицензию.,Nezakoupili jste požadovanou licenci.,Nie zakupiłeś wymaganej licencji.,Nem vásárolta meg a szükséges licencet.,Non hai acquistato la licenza richiesta.,Vous n'avez pas acheté la licence requise.,Vous n'avez pas acheté la licence requise.,Você não adquiriu a licença necessária.,必要なライセンスを購入していません。,
open_licence_menu,Open license office,Open license office,Öffne Lizenbüro,营业执照营业所,營業執照營業所,Офис с открытой лицензией,Otevřená licenční kancelář,Otwarte biuro licencji,Nyílt licenciroda,Apri ufficio licenze,Bureau des licences ouvert,Bureau des licences ouvert,Escritório de licença aberta,オープンライセンスオフィス,
depend_on,Depending on,Depending on,Abhängig von,根据,根據,В зависимости от,Záleží na,Zależy od,Attól függ,A seconda di,Selon,Selon,Dependendo,応じて,
Purchased,in possession,in possession,in Besitz,拥有,擁有,Во владении,v držení,w posiadaniu,birtokában,in possesso,en possession,en possession,em posse,所持,
start_crafting,Start crafting.,Start crafting.,Herstellung starten,开始制作。,開始製作。,Начни создавать.,Začněte s tvorbou.,Zacznij tworzyć.,Kezdje el a kézműveskedést.,Inizia a creare.,Commencez à fabriquer.,Commencez à fabriquer.,Comece a criar.,クラフトを開始します。,
item_crafted,Item crafted,Item crafted,Herstellung erfolgreich,精制物品,精製物品,Предмет создан,Zboží vytvořeno,Przedmiot stworzony,Készített cikk,Articolo realizzato,Objet fabriqué,Objet fabriqué,Item fabricado,細工されたアイテム,
not_enough_items_to_craft,Not all resources found.,Not all resources found.,Nicht alle Resourcen gefunden.,找不到所有资源。,找不到所有資源。,Не все ресурсы найдены.,Nebyly nalezeny všechny zdroje.,Nie znaleziono wszystkich zasobów.,Nem található meg minden erőforrás.,Non tutte le risorse trovate.,Toutes les ressources n'ont pas été trouvées.,Toutes les ressources n'ont pas été trouvées.,Nem todos os recursos encontrados.,すべてのリソースが見つかりません。,
missing_craft_item,Not all resources found.,Not all resources found.,Nicht alle Resourcen gefunden.,找不到所有资源。,找不到所有資源。,Не все ресурсы найдены.,Nebyly nalezeny všechny zdroje.,Nie znaleziono wszystkich zasobów.,Nem található meg minden erőforrás.,Non tutte le risorse trovate.,Toutes les ressources n'ont pas été trouvées.,Toutes les ressources n'ont pas été trouvées.,Nem todos os recursos encontrados.,すべてのリソースが見つかりません。,
not_enough_tools_to_craft,Not all tools found,Not all tools found,Nicht alle Werkzeuge gefunden.,并非找到所有工具,並非找到所有工具,Не все инструменты найдены,Nebyly nalezeny všechny nástroje,Nie znaleziono wszystkich narzędzi,Nem található minden eszköz,Non tutti gli strumenti trovati,Tous les outils n'ont pas été trouvés,Tous les outils n'ont pas été trouvés,Nem todas as ferramentas encontradas,すべてのツールが見つからない,
has_not_found_all_items_that_is_needed_to_craft,Not all resources found,Not all resources found,Nicht alle Resourcen gefunden.,找不到所有资源,找不到所有資源,Не все ресурсы найдены,Nebyly nalezeny všechny zdroje,Nie znaleziono wszystkich zasobów,Nem található meg minden erőforrás,Non tutte le risorse trovate,Toutes les ressources n'ont pas été trouvées,Toutes les ressources n'ont pas été trouvées,Nem todos os recursos encontrados,すべてのリソースが見つかりません,
break_door,Not all tools found.,Not all tools found.,Tür aufbrechen.,并非找到所有工具。,並非找到所有工具。,Не все инструменты найдены.,Nebyly nalezeny všechny nástroje.,Nie znaleziono wszystkich narzędzi.,Nem található minden eszköz.,Non tutti gli strumenti trovati.,Tous les outils n'ont pas été trouvés.,Tous les outils n'ont pas été trouvés.,Nem todas as ferramentas foram encontradas.,すべてのツールが見つかったわけではありません。,
raid_item_has_not_enough_helth,Burglary tool looks damaged. Get a new one.,Burglary tool looks damaged. Get a new one.,Einbruchswerkzeug schaut beschädigt aus. Besorge dir ein neues.,盗窃工具看起来已损坏。换一个新的。,盜竊工具看起來已損壞。換一個新的。,Инструмент для взлома выглядит поврежденным. Получите новый.,Nástroj vloupání vypadá poškozený. Získejte nový.,Narzędzie antywłamaniowe wygląda na uszkodzone. Kup nowy.,A betöréses eszköz sérültnek tűnik. Szerezz be újat.,Lo strumento antifurto sembra danneggiato. Acquistane uno nuovo.,L'outil de cambriolage semble endommagé. Obtenez-en un nouveau.,L'outil de cambriolage semble endommagé. Obtenez-en un nouveau.,A ferramenta de roubo parece danificada. Obtenha um novo.,盗難ツールが破損しているように見えます。新しいものを入手してください。,
you_can_not_raid_that_door,You can't break down this door,You can't break down this door,Du kannst diese Tür nicht aufbrechen.,你不能打破这扇门,你不能打破這扇門,Вы не можете сломать эту дверь,Ty dveře nemůžeš rozbít,Nie możesz wyważyć tych drzwi,Nem lehet betörni ezt az ajtót,Non puoi sfondare questa porta,Tu ne peux pas enfoncer cette porte,Tu ne peux pas enfoncer cette porte,Você não pode quebrar esta porta,このドアを壊すことはできません,
can_not_unlook_door,You cannot break this door.,You cannot break this door.,Du kannst die Tür nicht aufschließen.,你不能打破这扇门。,你不能打破這扇門。,Вы не можете сломать эту дверь.,Ty dveře nemůžeš rozbít.,Nie możesz wyłamać tych drzwi.,Nem lehet betörni ezt az ajtót.,Non puoi sfondare questa porta.,Vous ne pouvez pas briser cette porte.,Vous ne pouvez pas briser cette porte.,Você não pode quebrar esta porta.,このドアを壊すことはできません。,
can_not_look_door,You cannot lock the door.,You cannot lock the door.,Du kannst die Tür nicht abschließen.,您不能锁门。,您不能鎖門。,Вы не можете запереть дверь.,Nemůžete zamknout dveře.,Nie możesz zamknąć drzwi.,Nem lehet bezárni az ajtót.,Non puoi chiudere a chiave la porta.,Vous ne pouvez pas verrouiller la porte.,Vous ne pouvez pas verrouiller la porte.,Você não pode trancar a porta.,ドアをロックすることはできません。,
door_is_looked,Door is locked,Door is locked,Tür ist verschlossen,门已上锁,門已上鎖,Дверь заперта,Dveře jsou zamčené,Drzwi są zamknięte,Ajtó zárva van,La porta è chiusa,La porte est verrouillée,La porte est verrouillée,Porta está trancada,ドアがロックされています,
building_has_alrready_an_owner,The building already has an owner.,The building already has an owner.,Das Gebäude hat schon einen Besitzer.,该建筑物已拥有所有者。,該建築物已擁有所有者。,У здания уже есть собственник.,Budova již má vlastníka.,Budynek ma już właściciela.,Az épületnek már van tulajdonosa.,L'edificio ha già un proprietario.,Le bâtiment a déjà un propriétaire.,Le bâtiment a déjà un propriétaire.,O prédio já tem dono.,建物にはすでに所有者がいます。,
open_trader_menu,Open dealer.,Open dealer.,Händler öffnen.,打开经销商。,打開經銷商。,Открыть дилера.,Otevřený prodejce.,Otwórz dealera.,Nyitott kereskedő.,Rivenditore aperto.,Concessionnaire ouvert.,Concessionnaire ouvert.,Revendedor aberto.,オープンディーラー。,
Trader,Dealer,Dealer,Händler,经销商,經銷商,Дилер,Obchodník,Kupiec,Kereskedő,Rivenditore,Marchand,Marchand,Distribuidor,ディーラー,
Quantity,Quantity,Quantity,Menge,数量,數量,Количество,Množství,Ilość,Mennyiség,Quantità,Quantité,Quantité,Quantidade,量,
trade_was_successful,Trade was successful.,Trade was successful.,Handel war erfolgreich.,贸易成功。,貿易成功。,Торговля прошла успешно.,Obchod byl úspěšný.,Handel zakończył się sukcesem.,A kereskedelem sikeres volt.,Il commercio ha avuto successo.,Le commerce a réussi.,Le commerce a réussi.,O comércio foi bem-sucedido.,貿易は成功しました。,
you_have_to_trade_minimum_one_item,You must trade at least one item.,You must trade at least one item.,Du musst mindestens ein Gegenstand handeln.,您必须交易至少一件商品。,您必須交易至少一件商品。,Вы должны обменять хотя бы один предмет.,Musíte vyměnit alespoň jednu položku.,Musisz wymienić przynajmniej jeden przedmiot.,Legalább egy tételt el kell cserélnie.,Devi scambiare almeno un articolo.,Vous devez échanger au moins un objet.,Vous devez échanger au moins un objet.,Você deve negociar pelo menos um item.,少なくとも1つのアイテムを取引する必要があります。,
not_all_items_found_that_you_want_to_trade,Not found all items you want to trade.,Not found all items you want to trade.,"Nicht alle Gegenstände gefunden,die du handeln willst.",找不到您要交易的所有商品。,找不到您要交易的所有商品。,"Не найдены все предметы, которыми вы хотите обменять.","Nebyly nalezeny všechny položky, se kterými chcete obchodovat.","Nie znaleziono wszystkich przedmiotów, które chcesz wymienić.",Nem található az összes kereskedni kívánt elem.,Non sono stati trovati tutti gli articoli che desideri scambiare.,Vous n'avez pas trouvé tous les articles que vous souhaitez échanger.,Vous n'avez pas trouvé tous les objets que vous souhaitez échanger.,Não foram encontrados todos os itens que deseja trocar.,取引したいすべてのアイテムが見つかりませんでした。,
previewtext,Press middle mouse wheel for a preview.,Press middle mouse wheel for a preview.,Drücke Mittelmausrad für Vorschau!,按下鼠标中键进行预览。,按下鼠標中鍵進行預覽。,Нажмите среднее колесо мыши для предварительного просмотра.,Stisknutím prostředního kolečka myši zobrazíte náhled.,"Naciśnij środkowe kółko myszy, aby wyświetlić podgląd.",Az előnézet megtekintéséhez nyomja meg a középső egérgombot.,Premere la rotellina centrale del mouse per un'anteprima.,Appuyez sur la molette centrale de la souris pour un aperçu.,Appuyez sur la molette centrale de la souris pour un aperçu.,Pressione a roda do meio do mouse para uma visualização.,プレビューするには、マウスの中輪を押します。,
Inventory,Inventory,Inventory,Inventar,存货,存貨,Инвентарь,Inventář,Inwentarz,Leltár,Inventario,Inventaire,Inventaire,Inventário,在庫,
desc_storage_1,"crate with 50 slots,can randomly despawn","crate with 50 slots,can randomly despawn","Kiste mit 50 Slots,kann zufällig verschwinden",带有50个插槽的箱子，可以随机生成,帶有50個插槽的箱子，可以隨機生成,"Ящик с 50 слотами, может исчезнуть случайным образом.","přepravka s 50 sloty, lze náhodně despawn","skrzynia z 50 miejscami, może losowo zniknąć","láda 50 résszel, véletlenszerűen el tud hajni","cassa con 50 slot, può sparire casualmente","caisse avec 50 emplacements, peut disparaître au hasard","caisse avec 50 emplacements, peut disparaître au hasard","caixa com 50 slots, pode despawn aleatoriamente",50スロットのクレート、ランダムにデスポーンできます,
desc_storage_3,"crate with 50 slots,can randomly despawn","crate with 150 slots,can randomly despawn","Kiste mit 150 Slots,kann zufällig verschwinden",带有50个插槽的箱子，可以随机生成,帶有50個插槽的箱子，可以隨機生成,"Ящик с 50 слотами, может исчезнуть случайным образом.","přepravka s 50 sloty, lze náhodně despawn","skrzynia z 50 miejscami, może losowo zniknąć","láda 50 résszel, véletlenszerűen el tud hajni","cassa con 50 slot, può sparire casualmente","caisse avec 50 emplacements, peut disparaître au hasard","caisse avec 50 emplacements, peut disparaître au hasard","caixa com 50 slots, pode despawn aleatoriamente",50スロットのクレート、ランダムにデスポーンできます,
desc_storage_5,"crate with 50 slots,can randomly despawn","crate with 250 slots,can randomly despawn","Kiste mit 250 Slots,kann zufällig verschwinden",带有50个插槽的箱子，可以随机生成,帶有50個插槽的箱子，可以隨機生成,"Ящик с 50 слотами, может исчезнуть случайным образом.","bedna s 50 sloty, lze náhodně despawn","skrzynia z 50 miejscami, może losowo zniknąć","láda 50 résszel, véletlenszerűen el tud hajni","cassa con 50 slot, può sparire casualmente","caisse avec 50 emplacements, peut disparaître au hasard","caisse avec 50 emplacements, peut disparaître au hasard","caixa com 50 slots, pode despawn aleatoriamente",50スロットのクレート、ランダムにデスポーンできます,
Alarm_system,Alarm system,Alarm system,Alarmanlage,警报系统,警報系統,Аварийная система,Bezpečnostní systém,System alarmowy,Riasztó berendezés,Sistema d'allarme,Système d'alarme,Système d'alarme,Sistema de alarme,警報システム,
error_buying_alarm_system,Error: Alarm system could not be purchased,Error: Alarm system could not be purchased,Fehler: Alarmanlage konnte nicht gekauft werden.,错误：无法购买报警系统,錯誤：無法購買報警系統,Ошибка: не удалось купить систему охранной сигнализации,Chyba: Výstražný systém nelze zakoupit,Błąd: nie można kupić systemu alarmowego,Hiba: A riasztórendszert nem sikerült megvásárolni,Errore: impossibile acquistare il sistema di allarme,Erreur: le système d'alarme n'a pas pu être acheté,Erreur: le système d'alarme n'a pas pu être acheté,Erro: Não foi possível adquirir o sistema de alarme,エラー：警報システムを購入できませんでした,
error_buying_storage,Error: Storage could not be purchased,Error: Storage could not be purchased,Fehler: Lager konnte nicht gekauft werden.,错误：无法购买存储空间,錯誤：無法購買存儲空間,Ошибка: не удалось приобрести хранилище,Chyba: Úložiště nelze zakoupit,Błąd: nie można kupić miejsca na dane,Hiba: Nem sikerült megvásárolni a tárhelyet,Errore: impossibile acquistare lo spazio di archiviazione,Erreur: le stockage n'a pas pu être acheté,Erreur: le stockage n'a pas pu être acheté,Erro: não foi possível comprar armazenamento,エラー：ストレージを購入できませんでした,
successfully_buy_alarm_system,Alarm system successfully purchased,Alarm system successfully purchased,Alarmanlage erfolgreich gekauft.,警报系统已成功购买,警報系統已成功購買,Система охранной сигнализации успешно куплена,Poplašný systém byl úspěšně zakoupen,System alarmowy został zakupiony pomyślnie,A riasztórendszer sikeresen megvásárolható,Sistema di allarme acquistato con successo,Système d'alarme acheté avec succès,Système d'alarme acheté avec succès,Sistema de alarme adquirido com sucesso,警報システムの購入に成功,
Alarm_System_Level,Alarm System Level,Alarm System Level,Alarmanlage Stufe,报警系统级别,報警系統等級,Уровень системы сигнализации,Úroveň výstražného systému,Poziom systemu alarmowego,Riasztórendszer szintje,Livello del sistema di allarme,Niveau du système d'alarme,Niveau du système d'alarme,Nível do Sistema de Alarme,警報システムレベル,
Alarm_system_message_1,One of your houses is being broken into.,One of your houses is being broken into.,Eins deiner Häuser wird gerade aufgebrochen.,您的其中一间房屋被盗了。,您的其中一間房屋被盜了。,Один из ваших домов взломан.,Jeden z vašich domů je vloupán.,Włamano do jednego z twoich domów.,Az egyik házadba betörnek.,Una delle tue case è stata scassinata.,Una de sus casas está siendo asaltada.,Une de vos maisons est cambriolée.,Uma de suas casas está sendo invadida.,あなたの家の1つが侵入されています。,
Alarm_system_message_2,One of your houses is being broken into. House type:,One of your houses is being broken into. House type:,Eins deiner Häuser wird gerade aufgebrochen. Haustyp:,您的其中一间房屋被盗了。房屋类型：,您的其中一間房屋被盜了。房屋類型：,Один из ваших домов взломан. Тип дома:,Jeden z vašich domů je vloupán. Typ domu:,Włamano do jednego z twoich domów. Typ domu:,Az egyik házadba betörnek. Ház típusa:,Una delle tue case è stata scassinata. Tipo di casa:,Una de sus casas está siendo asaltada. Tipo de casa:,Une de vos maisons est cambriolée. Type de maison:,Uma de suas casas está sendo invadida. Tipo de casa:,あなたの家の1つが侵入されています。家のタイプ：,
Alarm_system_message_3,One of your houses is being broken into. House type / burglar:,One of your houses is being broken into. House type / burglar:,Eins deiner Häuser wird gerade aufgebrochen. Haustyp/Einbrecher:,您的其中一间房屋被盗了。房屋类型/防盗：,您的其中一間房屋被盜了。房屋類型/防盜：,Один из ваших домов взломан. Тип дома / взломщик:,Jeden z vašich domů je vloupán. Typ domu / zloděj:,Włamano do jednego z twoich domów. Typ domu / włamywacz:,Az egyik házadba betörnek. Ház típus / betörő:,Una delle tue case è stata scassinata. Tipo di casa / ladro:,Una de sus casas está siendo asaltada. Tipo de casa / ladrón:,Une de vos maisons est cambriolée. Type de maison / cambrioleur:,Uma de suas casas está sendo invadida. Tipo de casa / assaltante:,あなたの家の1つが侵入されています。家のタイプ/泥棒：,
Alarm_system_desc_1,"Alarm system level 1,if your house is broken into you get a message","Alarm system level 1,if your house is broken into you get a message","Alarmanlage stufe 1,wenn dein Haus aufgebrochen wird bekommst du eine Nachricht",警报系统级别1，如果您的房屋被闯入，您会收到一条消息,警報系統級別1，如果您的房屋被闖入，您會收到一條消息,"Сигнализация уровня 1, если ваш дом взломан, вы получите сообщение","Poplašný systém úrovně 1, pokud je váš dům rozbit, dostanete zprávu","System alarmowy poziomu 1, jeśli włamie się do Twojego domu, otrzymasz komunikat","1. riasztórendszer, ha betörik a háza, üzenetet kap","Sistema di allarme di livello 1, se la tua casa viene scassinata ricevi un messaggio","Nivel 1 del sistema de alarma, si alguien entra en su casa, recibe un mensaje","Système d'alarme niveau 1, si votre maison est cambriolée, vous recevez un message","Sistema de alarme de nível 1, se sua casa for invadida, você receberá uma mensagem",警報システムレベル1、あなたの家があなたに侵入した場合、あなたはメッセージを受け取ります,
Alarm_system_desc_2,"Alarm system level 2,if your house is broken into you will receive a message telling you what type of house it is.","Alarm system level 2,if your house is broken into you will receive a message telling you what type of house it is.","Alarmanlage stufe 2,wenn dein Haus aufgebrochen wird bekommst du eine Nachricht um welchen Haustypen es sich handelt",警报系统级别2，如果您的房屋被闯入，您将收到一条消息，告诉您房屋的类型。,警報系統級別2，如果您的房屋被闖入，您將收到一條消息，告訴您房屋的類型。,"Сигнализация уровня 2: если ваш дом взломан, вы получите сообщение о том, что это за дом.","Poplašný systém úrovně 2, pokud je váš dům rozbitý, obdržíte zprávu, která vám řekne, o jaký typ domu jde.","System alarmowy poziomu 2, jeśli włamie się do Twojego domu, otrzymasz komunikat informujący o typie domu.","A riasztórendszer 2. szintje, ha betörik a házába, üzenetet fog kapni arról, hogy milyen típusú házról van szó.","Sistema di allarme di livello 2, se la tua casa è scassinata riceverai un messaggio che ti dice che tipo di casa è.","Nivel 2 del sistema de alarma, si su casa es forzada, recibirá un mensaje que le indicará qué tipo de casa es.","Système d'alarme niveau 2, si votre maison est cambriolée, vous recevrez un message vous indiquant de quel type de maison il s'agit.","Sistema de alarme nível 2, se a sua casa for arrombada receberá uma mensagem a dizer que tipo de casa é.",警報システムレベル2、あなたの家が侵入された場合、あなたはそれがどんなタイプの家であるかをあなたに告げるメッセージを受け取ります。,
Alarm_system_desc_3,"Alarm system level 3,when your house is broken into you get a message about which house it is and the name of the burglar.","Alarm system level 3,when your house is broken into you get a message about which house it is and the name of the burglar.","Alarmanlage stufe 3,wenn dein Haus aufgebrochen wird bekommst du eine Nachricht um welches Haus es sich handelt und denn Namen vom Einbrecher",警报系统级别3，当您的房屋被闯入时，您会收到一条消息，告知其房屋名称和防盗名称。,警報系統級別3，當您的房屋被闖入時，您會收到一條有關房屋的信息以及防盜名稱。,"Сигнализация уровня 3: при взломе вашего дома вы получаете сообщение о том, какой это дом и имя грабителя.","Poplachový systém úrovně 3, když je váš dům rozbit, dostanete zprávu o tom, který dům je, a jméno zloděje.","System alarmowy poziomu 3, gdy włamie się do twojego domu, otrzymasz informację o tym, który to dom i nazwisko włamywacza.","3. riasztórendszer, amikor betörik a házába, üzenetet kap arról, hogy melyik házról van szó, és a betörő nevéről.","Sistema di allarme di livello 3, quando la tua casa viene scassinata ricevi un messaggio su quale casa è e il nome del ladro.","Nivel 3 del sistema de alarma, cuando ingresan a su casa, recibe un mensaje sobre qué casa es y el nombre del ladrón.","Système d'alarme de niveau 3, lorsque votre maison est cambriolée, vous recevez un message indiquant de quelle maison il s'agit et le nom du cambrioleur.","Sistema de alarme de nível 3, quando sua casa é invadida você recebe uma mensagem sobre a casa e o nome do ladrão.",警報システムレベル3、あなたの家が侵入されると、それがどの家であるか、そして泥棒の名前についてのメッセージを受け取ります。,
Workzone_name,Workzone,Workzone,Arbeitsbereich,工作区,工作區,Рабочая зона,Workzone,Strefa robocza,Workzone,Zona di lavoro,Zona de trabajo,Zone de travail,Zona de Trabalho,ワークゾーン,
tool_damage,Tool damage,Tool damage,Werkzeugschaden,工具损坏,工具損壞,Повреждение инструмента,Poškození nástroje,Uszkodzenie narzędzia,Szerszámkár,Danni allo strumento,Daño de la herramienta,Dommages aux outils,Dano de ferramenta,工具の損傷,
Tool,Tool,Tool,Werkzeug,工具,工具,Инструмент,Nástroj,Narzędzie,Eszköz,Attrezzo,Herramienta,Outil,Ferramenta,ツール,
Yield,Yield,Yield,Ertrag,屈服,屈服,Урожай,Výtěžek,Wydajność,Hozam,dare la precedenza,Producir,Rendement,Produção,産出,
