Language,original,english,german,chinesesimp,chinese,russian,czech,polish,hungarian,italian,spanish,french,portuguese,japanese,Column 16
open_house_menu,Open house menu,Open house menu,Öffne Hausmenü,开放日菜单,開放日菜單,Открыть меню,Den otevřených dveří,Otwórz menu domu,Nyitott ház menü,Menu della casa aperto,Menu portes ouvertes,Menu portes ouvertes,Menu da casa aberta,オープンハウスメニュー,
Housing_Menu,Housing Menu,Housing Menu,Haus Menü,房屋菜单,房屋菜單,Жилищное меню,Nabídka bydlení,Menu mieszkaniowe,Ház menü,Menu alloggi,Menu logement,Menu logement,Menu de habitação,住宅メニュー,
Buy_Price,Purchase price:,Purchase price:,Kaufpreis:,购买价格：,購買價格：,Цена:,Kupní cena:,Cena zakupu:,Vételár:,Prezzo d'acquisto:,Prix ​​d'achat:,Prix ​​d'achat:,Preço de compra:,購入金額：,
Sell_Price,Selling price:,Selling price:,Verkaufspreis:,售价：,售價：,Цена продажи:,Prodejní cena:,Cena sprzedaży:,Eladási ár:,Prezzo di vendita:,Prix ​​de vente:,Prix ​​de vente:,Preço de venda:,販売価格：,
Storage_Options,Storage:,Storage:,Lager:,贮存：,貯存：,Место хранения:,Úložný prostor:,Przechowywanie:,Tárolás:,Conservazione:,Espace de rangement:,Espace de rangement:,Armazenar:,ストレージ：,
Buy,Buy,Buy,Kaufen,买,買,Купить,Koupit,Kup,megvesz,Acquistare,Acheter,Acheter,Comprar,購入,
trade,trade,trade,handeln,贸易,貿易,торговля,obchod,handel,kereskedelmi,commercio,Commerce,Commerce,troca,トレード,
Sell,Sell,Sell,Verkaufen,卖,賣,Продавать,Prodat,Sprzedać,Elad,Vendere,Vendre,Vendre,Vender,売る,
Price,Price,Price,Preis,价格,價格,Цена,Cena,Cena £,Ár,Prezzo,Prix,Prix,Preço,価格,
sum,sum,sum,Summe,和,和,сумма,součet,suma,összeg,somma,somme,somme,soma,和,
sell_Shopping_Cart,Sell shopping cart contents,Sell shopping cart contents,Warenkorb Verkaufen,出售购物车内容,出售購物車內容,Продать содержимое корзины покупок,Prodejte obsah nákupního košíku,Sprzedawaj zawartość koszyka,A kosár tartalmának eladása,Vendi il contenuto del carrello,Vendre le contenu du panier,Vendre le contenu du panier,Venda o conteúdo do carrinho de compras,ショッピングカートの内容を販売する,
buy_Shopping_Cart,Buy shopping cart contents,Buy shopping cart contents,Warenkorb kaufen,购买购物车内容,購買購物車內容,Купить содержимое корзины покупок,Koupit obsah nákupního košíku,Kup zawartość koszyka,Vásároljon kosár tartalmát,Acquista il contenuto del carrello,Acheter le contenu du panier,Acheter le contenu du panier,Compre o conteúdo do carrinho de compras,ショッピングカートの内容を購入する,
Money,Money:,Money:,Bargeld:,钱：,錢：,Деньги:,Peníze:,Pieniądze:,Pénz:,I soldi:,De l'argent:,De l'argent:,Dinheiro:,お金：,
Housing_Info,Housing Info,Housing Info,Haus Info,房屋信息,房屋信息,Информация о жилье,Informace o bydlení,Informacje mieszkaniowe,Lakásinformáció,Informazioni sull'alloggio,Info logement,Info sur le logement,Informações sobre habitação,住宅情報,
Houses,Houses,Houses,Häuser,房屋,房屋,Дома,Domy,Domy,Házak,Case,Maisons,Maisons,Casas,住宅,
Housing_upgrade_info,House upgrade info,House upgrade info,Haus Upgrade Info,房屋升级信息,房屋升級信息,Информация об улучшении дома,Informace o upgradu domu,Informacje o aktualizacji domu,Ház frissítési információ,Informazioni sull'aggiornamento della casa,Informations sur la mise à niveau de la maison,Informations sur la mise à niveau de la maison,Informações de atualização de casa,家のアップグレード情報,
Housing_Upgrade_Menu,Housing Upgrade Menu,Housing Upgrade Menu,Haus Upgrade Menü,房屋升级菜单,房屋升級菜單,Меню улучшения жилья,Nabídka upgradu bydlení,Menu rozbudowy mieszkania,Házfrissítési menü,Menu di aggiornamento degli alloggi,Menu de mise à niveau du logement,Menu de mise à niveau du logement,Menu de atualização de habitação,住宅アップグレードメニュー,
Storage_Size,Storage Size:,Storage Size:,Lagergröße:,储存空间：,儲存空間：,Размер хранилища:,Velikost úložiště:,Rozmiar pamięci:,Tárolási méret:,Dimensioni di archiviazione:,Taille de stockage:,Taille de stockage:,Tamanho de armazenamento:,ストレージサイズ：,
Licence_Menu,License Menu,License Menu,Lizenzen Menü,许可证菜单,許可證菜單,Лицензионное меню,Nabídka Licence,Menu licencji,Licenc menü,Menu licenza,Menu de licence,Menu de licence,Menu de Licença,ライセンスメニュー,
License,License,License,Lizenzen,执照,執照,Лицензия,Licence,Licencja,Engedély,Licenza,Licence,Licence,Licença,ライセンス,
no_position_to_for_extension_found,No position found for the extension,No position found for the extension,Keine Position für die Erweiterung gefunden.,找不到扩展名的位置,找不到擴展名的位置,Позиция для расширения не найдена,Pro rozšíření nebyla nalezena žádná pozice,Nie znaleziono pozycji dla rozszerzenia,Nem található pozíció a kiterjesztéshez,Nessuna posizione trovata per l'estensione,Aucune position trouvée pour l'extension,Aucune position trouvée pour l'extension,Nenhuma posição encontrada para a extensão,拡張機能の位置が見つかりません,
max_storgage_is_allready_bought,Maximum number of storage extensions has already been purchased,Maximum number of storage extensions has already been purchased,Maximale Anzahl an Lagererweiterungen wurde bereits gekauft.,已购买最大数量的存储扩展,已購買最大數量的存儲擴展,Максимальное количество расширений хранилища уже приобретено,Maximální počet rozšíření úložiště již byl zakoupen,Kupiono już maksymalną liczbę rozszerzeń przestrzeni dyskowej,A tárhelybővítmények maximális számát már megvásárolták,Il numero massimo di estensioni di archiviazione è già stato acquistato,Le nombre maximum d'extensions de stockage a déjà été acheté,Le nombre maximum d'extensions de stockage a déjà été acheté,O número máximo de extensões de armazenamento já foi adquirido,最大数のストレージ拡張機能はすでに購入済みです,
strorage_can_not_spawn,Storage extensions can not be created,Storage extensions can not be created,Lagererweiterungen kann nicht erstellt werden.,无法创建存储扩展,無法創建存儲擴展,Расширения хранилища не могут быть созданы,Nelze vytvořit rozšíření úložiště,Nie można utworzyć rozszerzeń pamięci,Tárhelybővítmények nem hozhatók létre,Non è possibile creare estensioni di archiviazione,Les extensions de stockage ne peuvent pas être créées,Les extensions de stockage ne peuvent pas être créées,Extensões de armazenamento não podem ser criadas,ストレージ拡張機能を作成できません,
successfully_sell_house,Successfully sold house,Successfully sold house,Haus erfolgreich verkauft.,成功出售房屋,成功出售房屋,Успешно проданный дом,Dům byl úspěšně prodán,Dom sprzedany pomyślnie,Sikeresen eladott ház,Casa venduta con successo,Maison vendue avec succès,Maison vendue avec succès,Casa vendida com sucesso,家の売却に成功,
error_sell_house,There was an error. Please retry.,There was an error. Please retry.,Es ist ein Fehler beim Verkauf aufgetreten.,有一个错误。请重试。,有一個錯誤。請重試。,"Там была ошибка. Пожалуйста, попробуйте еще раз.",Byla tam chyba. Zkuste to prosím znovu.,Wystąpił błąd. Proszę spróbuj ponownie.,"Hiba történt. Kérjük, próbálkozzon újra.",C'era un errore. Per favore riprova.,Il y avait une erreur. Veuillez réessayer.,Il y avait une erreur. Veuillez réessayer.,Havia um erro. Por favor tente novamente.,エラーが発生しました。再試行してください。,
error_not_enough_money,"Error,you have not enough money.","Error,you have not enough money.",Nicht genug Geld vorhanden!,错误，您没有足够的钱。,錯誤，您沒有足夠的錢。,"Ошибка, у вас недостаточно денег.","Chyba, nemáte dost peněz.","Błąd, masz za mało pieniędzy.","Hiba, nincs elég pénzed.","Errore, non hai abbastanza soldi.","Erreur, vous n'avez pas assez d'argent.","Erreur, vous n'avez pas assez d'argent.","Erro, você não tem dinheiro suficiente.",エラー、あなたは十分なお金を持っていません。,
building_has_already_an_owner,The building has already an owner.,The building has already an owner.,Das Gebäude hat schon einen Besitzer.,该建筑物已有所有者。,該建築物已有所有者。,У дома уже есть собственник.,Budova již má vlastníka.,Budynek ma już właściciela.,Az épületnek már van tulajdonosa.,L'immobile ha già un proprietario.,Le bâtiment a déjà un propriétaire.,Le bâtiment a déjà un propriétaire.,O prédio já tem dono.,建物にはすでに所有者がいます。,
error_please_reopen_menu,"Error,please reconnect to game.","Error,please reconnect to game",Irgendwas ist schief gelaufen. Bitte neu einloggen.,错误，请重新连接游戏。,錯誤，請重新連接遊戲。,"Ошибка, пожалуйста, подключитесь к игре заново.","Chyba, znovu se prosím připojte ke hře.","Błąd, połącz się ponownie z grą.","Hiba, kérjük, csatlakozzon újra a játékhoz.","Errore, riconnettiti al gioco.","Erreur, veuillez vous reconnecter au jeu.","Erreur, veuillez vous reconnecter au jeu.","Erro, reconecte ao jogo.",エラー、ゲームに再接続してください。,
error_buying_house,"Error,please try again.","Error,please try again.",Irgendwas ist schief gelaufen. Bitte versuche es erneut.,错误，请重试。,錯誤，請重試。,"Ошибка, попробуйте еще раз.","Chyba, zkuste to prosím znovu.","Błąd, spróbuj ponownie.","Hiba, próbálkozzon újra.","Errore, riprova.","Erreur, veuillez réessayer.","Erreur, veuillez réessayer.","Erro, tente novamente.",エラー、もう一度やり直してください。,
successfully_buy_house,Successfully bought house.,Successfully bought house.,Haus wurde erfolgreich gekauft.,成功购房。,成功購房。,Успешно купленный дом.,Dům byl úspěšně zakoupen.,Dom zakupiony pomyślnie.,Sikeresen megvásárolt ház.,Casa acquistata con successo.,Maison achetée avec succès.,Maison achetée avec succès.,Casa comprada com sucesso.,家の購入に成功しました。,
error_buying_storage,"Error,extension can not be bought.","Error,extension can not be bought.",Erweiterung konnte nicht gekauft werden.,错误，扩展名无法购买。,錯誤，擴展名無法購買。,"Ошибка, расширение нельзя купить.","Chyba, rozšíření nelze zakoupit.","Błąd, nie można kupić rozszerzenia.","Hiba, a bővítmény nem vásárolható meg.","Errore, l'estensione non può essere acquistata.","Erreur, l'extension ne peut pas être achetée.","Erreur, l'extension ne peut pas être achetée.","Erro, a extensão não pode ser comprada.",エラー、拡張機能は購入できません。,
successfully_buy_storage,"Successfully,extension successfully bought.",Successfully bought extension.,Erweiterung erfolgreich gekauft.,成功，扩展成功购买。,成功，擴展成功購買。,"Успешно, расширение успешно куплено.",Rozšíření bylo úspěšně zakoupeno.,"Pomyślnie, pomyślnie kupiono rozszerzenie.",Sikeresen sikeresen megvásárolták a bővítményt.,"Con successo, estensione acquistata con successo.",L'extension a bien été achetée.,L'extension a bien été achetée.,"Com sucesso, extensão comprada com sucesso.",正常に、拡張機能は正常に購入されました。,
open_banking_menu,Open banking menu.,Open banking menu.,Banking öffnen.,打开银行菜单。,打開銀行菜單。,Откройте банковское меню.,Otevřete bankovní nabídku.,Otwórz menu bankowe.,Nyissa meg a banki menüt.,Apri il menu bancario.,Ouvrez le menu bancaire.,Ouvrez le menu bancaire.,Abra o menu do banco.,銀行メニューを開きます。,
error_deposit_is_not_a_int,"Error,deposit is not a int value.","Error,deposit is not a int value.",Eingabe ist keine ganze Zahl.,错误，存款不是int值。,錯誤，存款不是int值。,"Ошибка, значение депозита не является целым.","Chyba, vklad není hodnota int.","Błąd, depozyt nie jest wartością typu int.","Hiba, a betét nem int érték.","Errore, il deposito non è un valore int.","Erreur, le dépôt n'est pas une valeur int.","Erreur, le dépôt n'est pas une valeur int.","Erro, o depósito não é um valor int.",エラー、デポジットは整数値ではありません。,
error_not_enough_money_to_transfer,"Error,not enough money to transfer.","Error,not enough money to transfer.",Nicht genug Geld zum transferieren.,错误，资金不足。,錯誤，資金不足。,"Ошибка, недостаточно денег для перевода.","Chyba, nedostatek peněz k převodu.","Błąd, za mało pieniędzy do przesłania.","Hiba, nincs elég pénz az átutaláshoz.","Errore, denaro insufficiente per il trasferimento.","Erreur, pas assez d'argent à transférer.","Erreur, pas assez d'argent à transférer.","Erro, dinheiro insuficiente para transferir.",エラー、送金するのに十分なお金がありません。,
Banking_Menue,Banking Menu,Banking Menu,Bank Menü,银行菜单,銀行菜單,Банковское меню,Nabídka bankovnictví,Menu bankowe,Banki menü,Menu bancario,Menu bancaire,Menu bancaire,Menu Bancário,銀行メニュー,
Deposit,Deposit,Deposit,Einzahlen,订金,訂金,Депозит,Vklad,Kaucja,Letét,Depositare,Dépôt,Dépôt,Depósito,預り金,
Pay_out,Payout,Payout,Auszahlen,付款方式,付款方式,Выплата,Výplaty,Wypłata,Kifizetés,Pagamento,Paiement,Paiement,Pagamento,配当性向,
Player_Cash,Cash:,Cash:,Bargeld:,现金：,現金：,Наличные:,Hotovost:,Gotówka:,Készpénz:,Contanti:,Espèces:,Espèces:,Dinheiro:,現金：,
Player_Bank,Balance:,Balance:,Guthaben:,平衡：,平衡：,Баланс:,Zůstatek:,Saldo:,Egyensúly:,Equilibrio:,Équilibre:,Équilibre:,Balançado:,残高：,
rob_money,Rob Money,Rob Money,Geld rauben,抢钱,搶錢,Украсть деньги,Okrádat peníze,Kradnij pieniądze,Rabolj pénzt,Rubare soldi,Voler de l'argent,Rob Money,Roubar dinheiro,ロブマネー,
get_money_from_dead_body,Take money,Take money.,Geld plündern.,取钱,取錢,Взять деньги,Vezmi peníze,Brać pieniądze,Vegyél pénzt,Prendere soldi,Prend l'argent,Prend l'argent,Levar dinheiro,お金を取る,
Cash_at_Bank,Bank Balance:,Bank Balance:,Gesamt Bankguthaben:,银行存款余额：,銀行存款餘額：,Банковский баланс:,Bankovní zůstatek:,Saldo bankowe:,Banki egyenleg:,Saldo bancario:,Solde bancaire:,Solde bancaire:,Saldo bancário:,銀行預金残高：,
money_transfer_successful,"Money transfer successful,",Money transfer successful.,Geldtransfer war erfolgreich.,汇款成功，,匯款成功，,"Перевод денег выполнен успешно,","Převod peněz úspěšný,","Przelew zakończony sukcesem,","Pénzátutalás sikeres,","Trasferimento di denaro riuscito,","Transfert d'argent réussi,","Transfert d'argent réussi,","Transferência de dinheiro bem-sucedida,",送金に成功しました。,
building_has_all_storrage_positions_upgraded,"Building,all storage positions has  been upgraded.",Building: all storage positions has been upgraded.,Alle Lagerplätze wurden ausgebaut.,大楼，所有存储位置均已升级。,大樓，所有存儲位置已升級。,В здании обновлены все складские помещения.,"Budova, všechny pozice úložiště byly upgradovány.","Budynek, wszystkie miejsca przechowywania zostały ulepszone.","Épület, az összes tárolóhelyet korszerűsítették.","Edificio, tutte le posizioni di stoccaggio sono state aggiornate.","Bâtiment, toutes les positions de stockage ont été améliorées.","Bâtiment, toutes les positions de stockage ont été améliorées.","Prédio, todas as posições de armazenamento foram atualizadas.",建物、すべての保管場所がアップグレードされました。,
rob_bank,Rob bank,Rob bank.,Bank ausrauben.,罗伯·班克,羅伯·班克,Ограбить банк,Rob banka,Rob bank,Rob bank,Rapina la banca,Banque Rob,Banque Rob,Banco rob,ロブバンク,
stop_rob_bank,Stop bank rob,Stop bank rob.,Bankraub stoppen.,停止抢银行,停止搶銀行,Остановить ограбление банка,Zastavte bankovní loupež,Powstrzymaj napad na bank,Hagyd abba a bankrablást,Stop alla rapina in banca,Arrêter le braquage de banque,Arrêter le braquage de banque,Pare de roubar banco,銀行強盗をやめろ,
raid_has_not_finished,raid has not finished,raid has not finished,Überfall ist noch nicht beendet,突袭尚未结束,突襲尚未結束,Рейд не завершён,nájezd nebyl dokončen,nalot się nie zakończył,A raid még nem fejeződött be,raid non è terminato,le raid n'est pas terminé,le raid n'est pas terminé,raid não terminou,RAIDは終了していません,
take_robt_money,Take robt money,Take robt money,Geraubtes Geld nehmen,抢钱,搶錢,Возьмите деньги,Vezměte si ukradené peníze,Weź okradane pieniądze,Vedd el a pénzt,Prendi i soldi rubati,Prendre de l'argent volé,Prendre de l'argent volé,Leve dinheiro robt,奪い金を取る,
no_raid_has_started,No raid has started,No raid has started,Kein Überfall gestartet,没有突袭开始,沒有突襲開始,Рейд не начался,Žádný raid nezačal,Żaden nalot się nie rozpoczął,Nem kezdődött rajtaütés,Nessun raid è iniziato,Aucun raid n'a commencé,Aucun raid n'a commencé,Nenhuma invasão começou,RAIDは開始されていません,
bank_rob_was_stopped,Bank rob was stopped,Bank rob was stopped,Banküberfall wurde gestoppt,银行抢劫被阻止,銀行搶劫被阻止,Ограбление банка было остановлено,Bankovní lup byl zastaven,Napad na bank został zatrzymany,A bankrablást megállították,La rapina in banca è stata fermata,Le vol de banque a été arrêté,Le vol de banque a été arrêté,Assalto a banco foi parado,銀行強盗は停止されました,
not_in_near_of_raided_bank,Not in near of raided bank,Not in near of raided bank,Nicht in der Näher der überfallenden Bank.,不在突袭银行附近,不在突襲銀行附近,Не в районе ограбленного банка,Ne v blízkosti přepadené banky,Nie w pobliżu napadniętego banku,Nem a rajtaütött bank közelében,Non vicino a una banca saccheggiata,Pas à proximité de la banque attaquée,Pas à proximité de la banque attaquée,Não perto do banco invadido,襲撃された銀行の近くではない,
safe_is_open,"Safe is open,robber can take the money.","Safe is open now,robber can take the money now.","Tresor ist offen,die Räuber können sich das Geld nun schnappen.",保险柜是开放的，强盗可以拿钱。,保險櫃是開放的，強盜可以拿錢。,"Сейф открыт, грабитель может забрать деньги.","Trezor je otevřený, lupič si může vzít peníze.","Sejf jest otwarty, złodziej może zabrać pieniądze.","A széf nyitva van, a rabló elviheti a pénzt.","La cassaforte è aperta, il ladro può prendere i soldi.","Le coffre-fort est ouvert, le voleur peut prendre l'argent.","Le coffre-fort est ouvert, le voleur peut prendre l'argent.","O cofre está aberto, o ladrão pode levar o dinheiro.",安全は開いています、強盗はお金を取ることができます。,
dzl_safe_is_closed,Safe is closed,Safe is closed,Tresor ist geschlossen.,保险箱已关闭,保險箱已關閉,Сейф закрыт,Trezor je zavřený,Sejf jest zamknięty,A széf zárva van,La cassaforte è chiusa,Le coffre-fort est fermé,Le coffre-fort est fermé,O cofre está fechado,安全は閉鎖されています,
bank_can_not_be_used_in_moment,Bank cannot be used at the moment. Is there a robbery in progress or has a robbery just taken place?,Bank cannot be used at the moment. Is there a robbery in progress or has a robbery just taken place?,Bank kann im Moment nicht benutzt werden. Es läuft oder lief gerade ein Überfall?,目前无法使用银行。正在进行抢劫，还是刚发生抢劫？,目前無法使用銀行。正在進行搶劫嗎？還是剛發生搶劫？,Банком в настоящий момент пользоваться нельзя. Идет ограбление или только что произошло ограбление?,Banku nelze v tuto chvíli použít. Probíhá loupež nebo k loupeži právě došlo?,W tej chwili nie można użyć banku. Czy trwa napad lub napad właśnie się odbył?,"Bank jelenleg nem használható. Rablás van folyamatban, vagy éppen rablás történt?",La banca non può essere utilizzata al momento. È in corso una rapina o è appena avvenuta una rapina?,La banque ne peut pas être utilisée pour le moment. Y a-t-il un vol en cours ou un vol vient-il d'avoir lieu?,La banque ne peut pas être utilisée pour le moment. Y a-t-il un vol en cours ou un vol vient-il d'avoir lieu?,O banco não pode ser usado no momento. Há um assalto em andamento ou acaba de ocorrer um assalto?,現在、銀行はご利用いただけません。強盗が進行中ですか、それとも強盗が起こったばかりですか？,
bank_rob_was_successful,Bank robbery was successful. Loot:,Bank robbery was successful. Loot:,Bankraub war erfolgreich. Beute:,抢劫银行成功。抢劫：,銀行搶劫成功。搶劫：,Ограбление банка прошло успешно. Добыча:,Bankovní loupež byla úspěšná. Kořist:,Napad na bank zakończył się sukcesem. Łup:,A bankrablás sikeres volt. Zsákmány:,La rapina in banca ha avuto successo. Bottino:,Le vol de banque a réussi. Butin:,Le vol de banque a réussi. Butin:,O assalto a banco foi bem sucedido. Saque:,銀行強盗は成功しました。戦利品：,
bank_rob_was_started,Bank robbery was started,Bank robbery was started,Bankraub wurde gestartet.,开始抢劫银行,搶劫銀行開始了,Начато ограбление банка,Byla zahájena bankovní loupež,Rozpoczęto napad na bank,Bankrablást indítottak,È iniziata la rapina in banca,Le vol de banque a commencé,Le vol de banque a commencé,Assalto a banco foi iniciado,銀行強盗が始まった,
bank_rob_was_canceled,Bank robbery was cancelled.,Bank robbery was cancelled.,Bankraub wurde abgebrochen.,银行抢劫被取消。,銀行搶劫被取消。,Ограбление банка отменено.,Bankovní loupež byla zrušena.,Napad na bank został odwołany.,A bankrablást törölték.,La rapina in banca è stata annullata.,Le vol de banque a été annulé.,Le vol de banque a été annulé.,O assalto a banco foi cancelado.,銀行強盗は取り消されました。,
error_deposit_must_be_positiv,Transfer must be positive.,Transfer must be positive.,Überweisung muss positiv sein.,转移必须是积极的。,轉移必須是積極的。,Перевод должен быть положительным.,Převod musí být kladný.,Transfer musi być pozytywny.,Az átadásnak pozitívnak kell lennie.,Il trasferimento deve essere positivo.,Le transfert doit être positif.,Le transfert doit être positif.,A transferência deve ser positiva.,転送は正でなければなりません。,
error_no_player_was_selected,A player must be selected.,A player must be selected.,Es muss ein Spieler ausgewählt sein.,必须选择一个玩家。,必須選擇一個玩家。,Необходимо выбрать игрока.,Musí být vybrán hráč.,Gracz musi być wybrany.,Egy játékost kell kiválasztani.,Deve essere selezionato un giocatore.,Un joueur doit être sélectionné.,Un joueur doit être sélectionné.,Um jogador deve ser selecionado.,プレイヤーを選択する必要があります。,
error_you_cant_send_money_to_yourself,You cannot transfer money to yourself.,You cannot transfer money to yourself.,Du kannst dir selber kein Geld überweisen.,您不能向自己转账。,您不能向自己轉賬。,Вы не можете перевести деньги себе.,Peníze nemůžete převést na sebe.,Nie możesz przelać pieniędzy na siebie.,Nem utalhat pénzt magának.,Non puoi trasferire denaro a te stesso.,Vous ne pouvez pas vous transférer d'argent.,Vous ne pouvez pas vous transférer d'argent.,Você não pode transferir dinheiro para si mesmo.,自分に送金することはできません。,
Cash_Transfer,Cash transfer,Cash transfer,Überweisen.,现金转移,現金轉移,Денежный перевод,Hotovostní převod,Przelew pieniężny,Készpénz átutalás,Trasferimento in contanti,Transfert d'argent,Transfert d'argent,Transferência de dinheiro,現金送金,
start_work,Start working,Start working,Arbeit starten.,开工,開工,Начинай работать,Začít pracovat,Rozpocząć pracę,Kezdj dolgozni,Iniziare a lavorare,Commencer à travailler,Commencer à travailler,Comece a trabalhar,働き始める,
